{
  "$schema": "../../../schema/topic.schema.json",
  "id": "resilience-patterns",
  "schemaVersion": 1,
  "minAppVersion": "0.1",
  "track": "distributed",
  "title": "Timeout, retry, circuit breaker, bulkhead",
  "summary": "Các lớp bảo vệ khi gọi dependency: timeout, retry với exponential backoff và jitter, retry budget và retry ở một tầng; circuit breaker của Resilience4j (cửa sổ trượt, lời gọi chậm, `minimumNumberOfCalls`, breaker trong từng JVM); bulkhead; thứ tự lớp bọc; fallback có thể tệ hơn lỗi; load shedding và backpressure; `TimeLimiter` với code blocking; `@Retryable` của Spring 7; kiểm thử bằng gây lỗi thật.",
  "level": "mid",
  "order": 7,
  "minutes": 16,
  "prerequisites": ["distributed-fundamentals", "idempotency"],
  "terms": ["timeout", "retry-backoff", "jitter", "circuit-breaker", "bulkhead", "fallback", "load-shedding", "backpressure", "retry-budget", "metastable-failure"],
  "references": [
    { "title": "Resilience4j: CircuitBreaker", "url": "https://resilience4j.readme.io/docs/circuitbreaker" },
    { "title": "Resilience4j: Getting Started with Spring Boot 3 (aspect order)", "url": "https://resilience4j.readme.io/docs/getting-started-3" },
    { "title": "AWS Builders' Library: Timeouts, retries, and backoff with jitter", "url": "https://aws.amazon.com/builders-library/timeouts-retries-and-backoff-with-jitter/" },
    { "title": "Spring Framework Reference: Resilience Features", "url": "https://docs.spring.io/spring-framework/reference/core/resilience.html" }
  ],
  "blocks": [
    { "type": "layered", "file": "layered.md" },
    { "type": "simulation", "file": "simulation.json" },
    { "type": "breakLab", "file": "lab.json" },
    { "type": "callout", "style": "interview", "markdown": "Câu hỏi nối tiếp hay gặp: \"Bạn cấu hình circuit breaker thế nào, ngưỡng bao nhiêu?\" Đừng đọc số mặc định. Nói theo dữ liệu: lưu lượng tới dependency (quyết định cửa sổ và `minimumNumberOfCalls`), p99 bình thường của nó (quyết định ngưỡng lời gọi chậm và timeout), thời gian nó thường cần để hồi phục (quyết định thời gian mở), và fallback khi mở là gì. Rồi nói bạn đã kiểm tra cấu hình bằng cách gây lỗi thật như thế nào." },
    { "type": "callout", "style": "warning", "markdown": "Retry là thứ dễ thêm nhất và nguy hiểm nhất. Trước khi thêm một vòng retry, kiểm tra tầng trên và tầng dưới đã retry chưa (gateway, SDK, service mesh, driver database). Retry ở nhiều tầng biến một sự cố 30 giây thành một sự cố kéo dài hàng giờ." }
  ]
}
