{
  "$schema": "../../../schema/topic.schema.json",
  "id": "sharding-strategies",
  "schemaVersion": 1,
  "minAppVersion": "0.1",
  "track": "database",
  "title": "Sharding",
  "summary": "Khi nào thật sự cần sharding, chọn shard key theo access pattern, hash, range và directory, logical shard để resharding không phải chép lại tất cả, query và unique key xuyên shard, tenant quá lớn, Citus, Vitess và ShardingSphere, và chuyển từ một database sang nhiều shard mà không dừng hệ thống.",
  "level": "senior",
  "order": 21,
  "minutes": 20,
  "prerequisites": ["partitioning-index", "replication-ha"],
  "terms": ["sharding", "shard-key", "logical-shard", "directory-sharding", "resharding", "scatter-gather", "reference-table", "hot-partition", "partitioning", "partition-key", "global-index", "uuid-v7", "access-pattern", "logical-replication", "cdc", "pgbouncer", "keyset-pagination", "co-location", "replica-identity"],
  "references": [
    { "title": "Citus Documentation: Choosing the Distribution Column", "url": "https://docs.citusdata.com/en/stable/sharding/data_modeling.html" },
    { "title": "Vitess Documentation: Sharding", "url": "https://vitess.io/docs/reference/features/sharding/" },
    { "title": "Apache ShardingSphere: Sharding", "url": "https://shardingsphere.apache.org/document/current/en/features/sharding/" },
    { "title": "PostgreSQL Documentation: Logical Replication Row Filters", "url": "https://www.postgresql.org/docs/current/logical-replication-row-filter.html" }
  ],
  "blocks": [
    { "type": "layered", "file": "layered.md" },
    { "type": "diagram", "file": "diagram.json" },
    { "type": "scenario", "file": "scenario.json" },
    { "type": "callout", "style": "interview", "markdown": "Câu hỏi nối tiếp hay gặp: \"Sao không shard theo `hash(id) % N` cho đều?\" Đều thì có, nhưng hai cái giá. Một: đổi `N` từ 8 lên 9 thì khoảng 8/9 số key đổi shard, tức gần như chép lại toàn bộ dữ liệu; vì vậy hệ thống thật chia thành nhiều **logical shard** cố định (ví dụ 1.024) rồi gán chúng cho máy, hoặc dùng consistent hashing, để thêm máy chỉ phải chuyển một phần. Hai: `id` của đơn hàng không phải thứ mà mọi query đều có; lấy danh sách đơn của một khách sẽ phải hỏi mọi shard. Shard key tốt là thứ gom dữ liệu hay đọc cùng nhau vào một shard, thường là `tenant_id` hoặc `customer_id`." },
    { "type": "callout", "style": "warning", "markdown": "Sharding là quyết định gần như **không quay lại được**: mọi query, migration, backup, giám sát và cách xử lý sự cố đều thành N lần. Trước khi shard, thử hết: máy lớn hơn, read replica và cache cho đọc, partitioning và lưu trữ dữ liệu cũ sang chỗ rẻ hơn, tách các bảng không liên quan sang database riêng, xem lại query và index. Một PostgreSQL hay MySQL được tinh chỉnh tốt trên máy lớn chịu được nhiều hơn phần lớn mọi người nghĩ." }
  ]
}
